{
  "schemaVersion": "1.0",
  "courseId": "ko_a0_a1",
  "id": "u04",
  "title": "Necesidades cotidianas",
  "goal": "Contar de forma básica, reconocer comida y bebida, pedir algo y ubicar lugares frecuentes.",
  "prerequisites": [
    "u01",
    "u02",
    "u03"
  ],
  "romanizationPolicy": {
    "default": "hint_only"
  },
  "source": {
    "primary": [
      {
        "title": "Coreano Básico — Aris Davis",
        "pages": [
          21,
          22,
          23,
          24,
          25
        ]
      },
      {
        "title": "Primer contacto",
        "items": [
          23,
          33,
          58,
          59,
          60
        ]
      }
    ],
    "visual_validation": "Páginas 21, 22 y 25 renderizadas e inspeccionadas para recuperar Hangul perdido por la extracción."
  },
  "resourceRefs": {
    "visualAssetCatalog": "unit_04_visual_asset_catalog_v1.0.json"
  },
  "lessons": [
    {
      "id": "u04l01",
      "title": "Números nativos 1–10",
      "objective": "Reconocer y decir los números nativos del 1 al 10.",
      "estimatedMinutes": 14,
      "sourcePages": [
        21
      ],
      "dialogueRef": null,
      "dialogueRefs": [],
      "theory": [
        {
          "id": "u04l01_t01",
          "type": "explanation",
          "title": "Primer sistema de números",
          "text": "El coreano usa más de un sistema numérico según el contexto. Aquí empezamos únicamente con los números nativos del 1 al 10.",
          "payload": {}
        },
        {
          "id": "u04l01_t02",
          "type": "number_table",
          "title": null,
          "text": null,
          "payload": {
            "items": [
              {
                "number": 1,
                "hangul": "하나",
                "romanization": "hana"
              },
              {
                "number": 2,
                "hangul": "둘",
                "romanization": "dul"
              },
              {
                "number": 3,
                "hangul": "셋",
                "romanization": "set"
              },
              {
                "number": 4,
                "hangul": "넷",
                "romanization": "net"
              },
              {
                "number": 5,
                "hangul": "다섯",
                "romanization": "daseot"
              },
              {
                "number": 6,
                "hangul": "여섯",
                "romanization": "yeoseot"
              },
              {
                "number": 7,
                "hangul": "일곱",
                "romanization": "ilgop"
              },
              {
                "number": 8,
                "hangul": "여덟",
                "romanization": "yeodeol"
              },
              {
                "number": 9,
                "hangul": "아홉",
                "romanization": "ahop"
              },
              {
                "number": 10,
                "hangul": "열",
                "romanization": "yeol"
              }
            ]
          }
        }
      ],
      "activities": [
        {
          "id": "u04l01_a01",
          "type": "matching",
          "family": "matching",
          "objective": "Reconocer números 1–5.",
          "prompt": "Relaciona número y Hangul.",
          "scoreMode": "auto",
          "normalization": {
            "trim": true,
            "unicode_normalization": "NFC",
            "collapse_spaces": true,
            "ignore_terminal_punctuation": true,
            "case_sensitive": false
          },
          "hints": [
            "Empieza por los cinco primeros."
          ],
          "feedback": {
            "correct": "Bien. Ya reconoces 1–5.",
            "wrong": {
              "default": "Compara cada palabra con su significado y prueba otra vez."
            }
          },
          "completionRule": null,
          "note": null,
          "capabilities": {
            "hasTts": false,
            "usesKeyboard": false,
            "usesImages": false,
            "usesSpeechRecognition": false,
            "autosave": false,
            "romanization": null
          },
          "payload": {
            "pairs": [
              {
                "left": "1",
                "right": "하나"
              },
              {
                "left": "2",
                "right": "둘"
              },
              {
                "left": "3",
                "right": "셋"
              },
              {
                "left": "4",
                "right": "넷"
              },
              {
                "left": "5",
                "right": "다섯"
              }
            ]
          }
        },
        {
          "id": "u04l01_a02",
          "type": "matching",
          "family": "matching",
          "objective": "Reconocer números 6–10.",
          "prompt": "Relaciona número y Hangul.",
          "scoreMode": "auto",
          "normalization": {
            "trim": true,
            "unicode_normalization": "NFC",
            "collapse_spaces": true,
            "ignore_terminal_punctuation": true,
            "case_sensitive": false
          },
          "hints": [
            "Trabaja ahora 6–10."
          ],
          "feedback": {
            "correct": "Correcto. Ya tienes el conjunto 1–10.",
            "wrong": {
              "default": "Compara cada palabra con su significado y prueba otra vez."
            }
          },
          "completionRule": null,
          "note": null,
          "capabilities": {
            "hasTts": false,
            "usesKeyboard": false,
            "usesImages": false,
            "usesSpeechRecognition": false,
            "autosave": false,
            "romanization": null
          },
          "payload": {
            "pairs": [
              {
                "left": "6",
                "right": "여섯"
              },
              {
                "left": "7",
                "right": "일곱"
              },
              {
                "left": "8",
                "right": "여덟"
              },
              {
                "left": "9",
                "right": "아홉"
              },
              {
                "left": "10",
                "right": "열"
              }
            ]
          }
        },
        {
          "id": "u04l01_a03",
          "type": "listen_and_choose",
          "family": "choice",
          "objective": "Asociar audio y número.",
          "prompt": "Escucha y elige la opción correcta.",
          "scoreMode": "auto",
          "normalization": {
            "trim": true,
            "unicode_normalization": "NFC",
            "collapse_spaces": true,
            "ignore_terminal_punctuation": true,
            "case_sensitive": false
          },
          "hints": [
            "Es uno de los cuatro primeros."
          ],
          "feedback": {
            "correct": "Correcto: 셋 = 3.",
            "wrong": {
              "default": "Escucha otra vez; usa la velocidad lenta si lo necesitas."
            }
          },
          "completionRule": null,
          "note": null,
          "capabilities": {
            "hasTts": true,
            "usesKeyboard": false,
            "usesImages": false,
            "usesSpeechRecognition": false,
            "autosave": false,
            "romanization": null
          },
          "payload": {
            "tts": {
              "locale": "ko-KR",
              "text": "셋",
              "slow_available": true
            },
            "options": [
              "둘",
              "셋",
              "넷",
              "열"
            ],
            "correct": [
              "셋"
            ]
          }
        },
        {
          "id": "u04l01_a04",
          "type": "multiple_choice",
          "family": "choice",
          "objective": "Recordar 10.",
          "prompt": "¿Cómo se escribe 10?",
          "scoreMode": "auto",
          "normalization": {
            "trim": true,
            "unicode_normalization": "NFC",
            "collapse_spaces": true,
            "ignore_terminal_punctuation": true,
            "case_sensitive": false
          },
          "hints": [
            "Es la última entrada de la tabla."
          ],
          "feedback": {
            "correct": "Correcto: 열 = 10.",
            "wrong": {
              "default": "Revisa el contenido y vuelve a intentarlo."
            }
          },
          "completionRule": null,
          "note": null,
          "capabilities": {
            "hasTts": false,
            "usesKeyboard": false,
            "usesImages": false,
            "usesSpeechRecognition": false,
            "autosave": false,
            "romanization": null
          },
          "payload": {
            "options": [
              "아홉",
              "열",
              "여덟",
              "하나"
            ],
            "correct": [
              "열"
            ]
          }
        },
        {
          "id": "u04l01_a05",
          "type": "sequence_order",
          "family": "ordering",
          "objective": "Ordenar 1–5.",
          "prompt": "Ordena de 1 a 5.",
          "scoreMode": "auto",
          "normalization": {},
          "hints": [
            "Empieza por 하나."
          ],
          "feedback": {
            "correct": "Perfecto: 하나, 둘, 셋, 넷, 다섯.",
            "wrong": {
              "default": "Repasa el orden 1–5."
            }
          },
          "completionRule": null,
          "note": null,
          "capabilities": {
            "hasTts": false,
            "usesKeyboard": false,
            "usesImages": false,
            "usesSpeechRecognition": false,
            "autosave": false,
            "romanization": null
          },
          "payload": {
            "tokens": [
              "셋",
              "하나",
              "다섯",
              "둘",
              "넷"
            ],
            "correct_order": [
              "하나",
              "둘",
              "셋",
              "넷",